{
  "artifact_type": "session-export-record",
  "export_id": "SEX-MRQBPRKP-JYVIV8",
  "recorded_at": "2026-07-18T12:08:51.673Z",
  "work_item_id": "TASK-100",
  "work_item_ref": ".aof/tasks/done/TASK-100.json",
  "export_status": "ready",
  "source_session_ref": ".aof/artifacts/agent-sessions/SESS-V80-EXTERNAL-RESOURCE-RUNTIME.json",
  "provider_source": {
    "provider": "local",
    "model": "codex",
    "source_format": "aof-agent-session-record",
    "source_of_truth_boundary": "AOF session export normalizes local session evidence; provider stream is not canonical truth."
  },
  "event_summaries": [
    {
      "event_id": "EVT-1",
      "event_type": "prompt",
      "summary": "operator advanced AOF to v8.0",
      "artifact_refs": [
        ".aof/tasks/done/TASK-100.json"
      ]
    },
    {
      "event_id": "EVT-2",
      "event_type": "response",
      "summary": "runtime selected external resource governance as bounded v8 slice",
      "artifact_refs": [
        "docs/v8.0-direction-review.md"
      ]
    },
    {
      "event_id": "EVT-3",
      "event_type": "tool_call",
      "summary": "ran external-resource-audit",
      "artifact_refs": [
        ".aof/artifacts/external-resources/external-resource-audit.json"
      ]
    },
    {
      "event_id": "EVT-4",
      "event_type": "artifact_write",
      "summary": "wrote v8 external resource artifacts",
      "artifact_refs": [
        "schemas/aof-external-runtime-resource-record.schema.json",
        "src/commands/external-resource-audit.js"
      ]
    },
    {
      "event_id": "EVT-5",
      "event_type": "verification",
      "summary": "external-resource-audit passed",
      "artifact_refs": [
        ".aof/artifacts/external-resources/external-resource-audit.json"
      ]
    },
    {
      "event_id": "EVT-6",
      "event_type": "blocker",
      "summary": "no active blocker after bounded read-only resource proof",
      "artifact_refs": [
        ".aof/artifacts/execution/council-reviews/CREV-TASK-100-V80.json"
      ]
    },
    {
      "event_id": "EVT-7",
      "event_type": "stop_condition",
      "summary": "stop if v8 claims autonomous external execution",
      "artifact_refs": [
        "docs/v8.0-direction-review.md"
      ]
    }
  ],
  "links": {
    "task_refs": [
      ".aof/tasks/done/TASK-100.json"
    ],
    "requirement_refs": [
      "docs/v8.0-direction-review.md"
    ],
    "test_evidence_refs": [
      ".aof/artifacts/external-resources/external-resource-audit.json"
    ],
    "artifact_refs": [
      "schemas/aof-external-runtime-resource-record.schema.json",
      "schemas/aof-external-resource-use-record.schema.json"
    ],
    "risk_candidates": [
      "external resource evidence overclaimed as semantic truth"
    ],
    "decision_candidates": [
      "external-resource-audit is a v8 release gate"
    ],
    "release_ready_evidence_refs": [
      ".aof/artifacts/external-resources/external-resource-audit.json"
    ]
  },
  "redaction_boundary": "summaries only; no secrets, credentials, billing, deploy, or production writes are exported",
  "release_ready_boundary": "structural/runtime v8 external resource governance evidence only",
  "not_proven": "Session export does not prove external provider execution, semantic truth, or operator acceptance.",
  "source_task_id": "TASK-100",
  "source_parent_session_id": "SESS-V80-EXTERNAL-RESOURCE-RUNTIME",
  "source_decision_record_id": "CREV-TASK-100-V80",
  "notes": null
}
